{
  "$schema": "https://json-schema.org/draft/2020-12/schema",
  "$id": "https://websitemcp.inferise.com/schema/1.0/contract.json",
  "title": "WebSiteMCP Contract",
  "description": "The contract format: a category's shared, versioned tool interface, authored once and reused by every site that implements the category.",
  "type": "object",
  "additionalProperties": false,
  "required": ["kind", "id", "version", "description", "tools"],
  "properties": {
    "$schema": {
      "type": "string",
      "description": "Optional URL of the schema this file follows."
    },
    "kind": {
      "const": "contract",
      "description": "Marks this file as a contract."
    },
    "id": {
      "type": "string",
      "pattern": "^[a-z][a-z0-9]*$",
      "description": "The category's machine id (e.g. `bank`); matches the filename before `@`."
    },
    "version": {
      "$ref": "#/$defs/semver",
      "description": "The interface version; bump it on any tool or input/output change. Matches `@<version>` in the filename."
    },
    "description": { "type": "string" },
    "required": {
      "type": "array",
      "description": "Baseline tools every site's binding must implement to claim this category.",
      "items": { "$ref": "#/$defs/toolName" },
      "uniqueItems": true
    },
    "tools": {
      "type": "object",
      "description": "Every tool this category offers, keyed by tool id; must include a `reachable` probe.",
      "minProperties": 1,
      "required": ["reachable"],
      "propertyNames": { "$ref": "#/$defs/toolName" },
      "additionalProperties": { "$ref": "#/$defs/tool" }
    }
  },
  "$defs": {
    "semver": {
      "type": "string",
      "pattern": "^[0-9]+\\.[0-9]+$",
      "description": "A MAJOR.MINOR version string."
    },
    "toolName": {
      "type": "string",
      "pattern": "^[a-z][a-zA-Z0-9]*$"
    },
    "tool": {
      "type": "object",
      "additionalProperties": false,
      "required": ["description", "inputSchema", "outputSchema"],
      "properties": {
        "description": {
          "type": "string",
          "description": "One sentence telling an agent what the tool does and when to use it."
        },
        "inputSchema": {
          "$ref": "#/$defs/schemaObject",
          "description": "The tool's inputs, as an object of named parameter fields."
        },
        "outputSchema": {
          "$ref": "#/$defs/schemaObject",
          "description": "The tool's output, as an object of named result fields."
        },
        "errors": {
          "type": "array",
          "description": "The full set of errors this tool can return.",
          "items": { "$ref": "#/$defs/error" },
          "uniqueItems": true
        }
      }
    },
    "error": {
      "type": "object",
      "additionalProperties": false,
      "required": ["code"],
      "properties": {
        "code": {
          "type": "string",
          "pattern": "^[A-Z][A-Z0-9_]*$",
          "description": "Stable identifier for this failure so the caller can detect and branch on it (e.g. `INSUFFICIENT_FUNDS`)."
        },
        "message": {
          "type": "string",
          "description": "Human-readable detail of the error."
        }
      }
    },
    "schemaObject": {
      "type": "object",
      "description": "A small JSON-Schema subset for inputSchema and outputSchema: a `type`, plus `properties`/`required` for objects.",
      "required": ["type"],
      "properties": {
        "type": {
          "enum": ["object", "string", "number", "integer", "boolean", "array"]
        },
        "description": { "type": "string" },
        "properties": {
          "type": "object",
          "additionalProperties": { "$ref": "#/$defs/schemaObject" }
        },
        "required": {
          "type": "array",
          "items": { "type": "string" },
          "uniqueItems": true
        },
        "items": { "$ref": "#/$defs/schemaObject" },
        "enum": { "type": "array" },
        "format": { "type": "string" },
        "minimum": { "type": "number" },
        "maximum": { "type": "number" }
      },
      "allOf": [
        {
          "if": { "properties": { "type": { "const": "object" } } },
          "then": { "required": ["properties"] }
        }
      ]
    }
  }
}
